FECHAINGRESO	TIPO	CODIGO	CAPITULO	PARTIDA	APLICASICETAC	NECESITASUBPARTIDA	HIDROCARBURO	UNIDADGALONES	IMPOCONSUMO	MERCANCIAPELIGROSA	CLASEDIVISION	PELIGROSECUNDARIO	GRUPOEMBALAJEENVASE	NOMBREYDESCRIPCION	ALERTA	
2025/11/09 10:30:53	CP	1432	CLASE 4 - SÓLIDOS INFLAMABLES	1432 - 4.3 - FOSFURO SÓDICO	 	 	NO	 	NO	SI	4.3	6.1	I	FOSFURO DE SODIO	 	
2025/11/09 10:31:03	CP	1431	CLASE 4 - SÓLIDOS INFLAMABLES	1431 - 4.2 - METILATO SÓDICO	 	 	NO	 	NO	SI	4.2	8	II	METILATO DE SODIO	 	
2025/11/09 10:31:27	CP	1428	CLASE 4 - SÓLIDOS INFLAMABLES	1428 - 4.3 - SODIO	 	 	NO	 	NO	SI	4.3	 	I	SODIO	 	
2025/11/09 10:31:36	CP	1427	CLASE 4 - SÓLIDOS INFLAMABLES	1427 - 4.3 - HIDRURO SÓDICO	 	 	NO	 	NO	SI	4.3	 	I	HIDRURO DE SODIO	 	
2025/11/09 10:31:44	CP	1426	CLASE 4 - SÓLIDOS INFLAMABLES	1426 - 4.3 - BOROHIDRURO SÓDICO	 	 	NO	 	NO	SI	4.3	 	I	BOROHIDRURO DE SODIO	 	
2025/11/09 10:32:00	CP	1423	CLASE 4 - SÓLIDOS INFLAMABLES	1423 - 4.3 - RUBIDIO	 	 	NO	 	NO	SI	4.3	 	I	RUBIDIO	 	
2025/11/09 10:32:08	CP	1422	CLASE 4 - SÓLIDOS INFLAMABLES	1422 - 4.3 - POTASIO Y SODIO; ALEACIONES LÍQUIDAS DE	 	 	NO	 	NO	SI	4.3	 	I	POTASIO Y SODIO, ALEACIONES LÍQUIDAS DE	 	
2025/11/09 10:32:16	CP	1421	CLASE 4 - SÓLIDOS INFLAMABLES	1421 - 4.3 - METALES ALCALINOS; ALEACIÓN LÍQUIDA DE; N.E.P.	 	 	NO	 	NO	SI	4.3	 	I	METALES ALCALINOS, ALEACIÓN LÍQUIDA DE, N.E.P.	 	
2025/11/09 10:32:26	CP	1420	CLASE 4 - SÓLIDOS INFLAMABLES	1420 - 4.3 - POTASIO METÁLICO; ALEACIONES LÍQUIDAS DE	 	 	NO	 	NO	SI	4.3	 	I	POTASIO, ALEACIONES METÁLICAS LÍQUIDAS DE	 	
2025/11/09 10:32:49	CP	1419	CLASE 4 - SÓLIDOS INFLAMABLES	1419 - 4.3 - FOSFURO DE MAGNESIO Y ALUMINIO	 	 	NO	 	NO	SI	4.3	6.1	I	FOSFURO DE MAGNESIO Y ALUMINIO	 	
2025/11/09 10:32:58	CP	1418	CLASE 4 - SÓLIDOS INFLAMABLES	1418 - 4.3 - MAGNESIO EN POLVO O ALEACIONES DE MAGNESIO EN POLVO	 	 	NO	 	NO	SI	4.3	4.2	I, II, III	MAGNESIO EN POLVO o ALEACIONES DE MAGNESIO EN POLVO	 	
2025/11/09 10:33:08	CP	1417	CLASE 4 - SÓLIDOS INFLAMABLES	1417 - 4.3 - LITIOSILICIO	 	 	NO	 	NO	SI	4.3	 	II	LITIOSILICIO	 	
2025/11/09 10:33:21	CP	1415	CLASE 4 - SÓLIDOS INFLAMABLES	1415 - 4.3 - LITIO	 	 	NO	 	NO	SI	4.3	 	I	LITIO	 	
2025/11/09 10:33:28	CP	1414	CLASE 4 - SÓLIDOS INFLAMABLES	1414 - 4.3 - HIDRURO DE LITIO	 	 	NO	 	NO	SI	4.3	 	I	HIDRURO DE LITIO	 	
2025/11/09 10:33:38	CP	1413	CLASE 4 - SÓLIDOS INFLAMABLES	1413 - 4.3 - BOROHIDRURO DE LITIO	 	 	NO	 	NO	SI	4.3	 	I	BOROHIDRURO DE LITIO	 	
2025/11/09 10:33:51	CP	1411	CLASE 4 - SÓLIDOS INFLAMABLES	1411 - 4.3 - HIDRURO ÉTEREO DE LITIO Y ALUMINIO	 	 	NO	 	NO	SI	4.3	3	I	HIDRURO DE LITIO Y ALUMINIO EN ÉTER	 	
2025/11/09 10:33:59	CP	1410	CLASE 4 - SÓLIDOS INFLAMABLES	1410 - 4.3 - HIDRURO DE LITIO Y ALUMINIO	 	 	NO	 	NO	SI	4.3	 	I	HIDRURO DE LITIO Y ALUMINIO	 	
2025/11/09 10:34:18	CP	1409	CLASE 4 - SÓLIDOS INFLAMABLES	1409 - 4.3 - HIDRUROS METÁLICOS QUE REACCIONAN CON EL AGUA; N.E.P.	 	 	NO	 	NO	SI	4.3	 	I, II	HIDRUROS METÁLICOS QUE REACCIONAN CON EL AGUA, N.E.P.	 	
2025/11/09 10:34:26	CP	1408	CLASE 4 - SÓLIDOS INFLAMABLES	1408 - 4.3 - FERROSILICIO CON EL 30% O MÁS PERO MENOS DEL 90% DE SILICIO	 	 	NO	 	NO	SI	4.3	6.1	III	FERROSILICIO con el 30 % o más pero menos del 90 % de silicio	 	
2025/11/09 10:34:34	CP	1407	CLASE 4 - SÓLIDOS INFLAMABLES	1407 - 4.3 - CESIO	 	 	NO	 	NO	SI	4.3	 	I	CESIO	 	
2025/11/09 10:34:45	CP	1405	CLASE 4 - SÓLIDOS INFLAMABLES	1405 - 4.3 - SILICIURO CÁLCICO	 	 	NO	 	NO	SI	4.3	 	II, III	SILICIURO DE CALCIO	 	
2025/11/09 10:34:55	CP	1404	CLASE 4 - SÓLIDOS INFLAMABLES	1404 - 4.3 - HIDRURO CÁLCICO	 	 	NO	 	NO	SI	4.3	 	I	HIDRURO DE CALCIO	 	
2025/11/09 10:35:03	CP	1403	CLASE 4 - SÓLIDOS INFLAMABLES	1403 - 4.3 - CIANAMIDA CÁLCICA CON MÁS DEL 0;1% DE CARBURO DE CALCIO	 	 	NO	 	NO	SI	4.3	 	III	CIANAMIDA DE CALCIO con más del 0,1 % de carburo de calcio	 	
2025/11/09 10:35:13	CP	1402	CLASE 4 - SÓLIDOS INFLAMABLES	1402 - 4.3 - CARBURO CÁLCICO	 	 	NO	 	NO	SI	4.3	 	I, II	CARBURO DE CALCIO	 	
2025/11/09 10:35:20	CP	1401	CLASE 4 - SÓLIDOS INFLAMABLES	1401 - 4.3 - CALCIO	 	 	NO	 	NO	SI	4.3	 	II	CALCIO	 	
2025/11/09 10:35:29	CP	1400	CLASE 4 - SÓLIDOS INFLAMABLES	1400 - 4.3 - BARIO	 	 	NO	 	NO	SI	4.3	 	II	BARIO	 	
2025/11/09 10:56:15	CP	1398	CLASE 4 - SÓLIDOS INFLAMABLES	1398 - 4.3 - ALUMINIOSILICIO EN POLVO; NO RECUBIERTO	 	 	NO	 	NO	SI	4.3	 	III	ALUMINIOSILICIO EN POLVO, NO RECUBIERTO	 	
2025/11/09 10:56:30	CP	1397	CLASE 4 - SÓLIDOS INFLAMABLES	1397 - 4.3 - FOSFURO ALUMÍNICO	 	 	NO	 	NO	SI	4.3	6.1	I	FOSFURO DE ALUMINIO	 	
2025/11/09 10:56:38	CP	1396	CLASE 4 - SÓLIDOS INFLAMABLES	1396 - 4.3 - ALUMINIO EN POLVO; NO RECUBIERTO	 	 	NO	 	NO	SI	4.3	 	III	ALUMINIO EN POLVO, NO RECUBIERTO	 	
2025/11/09 10:56:46	CP	1395	CLASE 4 - SÓLIDOS INFLAMABLES	1395 - 4.3 - ALUMINIOFERROSILICIO EN POLVO	 	 	NO	 	NO	SI	4.3	6.1	II	ALUMINIOFERROSILICIO EN POLVO	 	
2025/11/09 10:56:54	CP	1394	CLASE 4 - SÓLIDOS INFLAMABLES	1394 - 4.3 - CARBURO ALUMÍNICO	 	 	NO	 	NO	SI	4.3	 	II	CARBURO DE ALUMINIO	 	
2025/11/09 10:57:02	CP	1393	CLASE 4 - SÓLIDOS INFLAMABLES	1393 - 4.3 - METALES ALCALINOTÉRREOS; ALEACIÓN DE; N.E.P.	 	 	NO	 	NO	SI	4.3	 	II	METALES ALCALINOTÉRREOS, ALEACIÓN DE, N.E.P.	 	
2025/11/09 10:57:11	CP	1392	CLASE 4 - SÓLIDOS INFLAMABLES	1392 - 4.3 - METALES ALCALINOTÉRREOS; AMALGAMA LÍQUIDA DE	 	 	NO	 	NO	SI	4.3	 	I	METALES ALCALINOTÉRREOS, AMALGAMA LÍQUIDA DE	 	
2025/11/09 10:57:19	CP	1391	CLASE 4 - SÓLIDOS INFLAMABLES	1391 - 4.3 - METALES ALCALINOS; DISPERSIÓN DE; O METALES ALCALINOTÉRREOS; DISPER	 	 	NO	 	NO	SI	4.3	 	I	METALES ALCALINOS, DISPERSIÓN DE, o METALES ALCALINOTÉRREOS, DISPERSIÓN DE	 	
2025/11/09 10:57:29	CP	1390	CLASE 4 - SÓLIDOS INFLAMABLES	1390 - 4.3 - AMIDAS DE METALES ALCALINOS	 	 	NO	 	NO	SI	4.3	 	II	AMIDAS DE METALES ALCALINOS	 	
2025/11/09 10:57:52	CP	1389	CLASE 4 - SÓLIDOS INFLAMABLES	1389 - 4.3 - METALES ALCALINOS; AMALGAMA LÍQUIDA DE;	 	 	NO	 	NO	SI	4.3	 	I	METALES ALCALINOS, AMALGAMA LÍQUIDA DE,	 	
2025/11/09 10:58:16	CP	1387	CLASE 4 - SÓLIDOS INFLAMABLES	1387 - 4.2 - DESECHOS DE LANA; HÚMEDOS	 	 	NO	 	NO	SI	4.2	 	III	DESECHOS DE LANA, HÚMEDOS	 	
2025/11/09 10:58:24	CP	1386	CLASE 4 - SÓLIDOS INFLAMABLES	1386 - 4.2 - TORTA OLEAGINOSA CON MÁS DEL 1;5% DE ACEITE Y UN MÁXIMO DEL 11% DE	 	 	NO	 	NO	SI	4.2	 	III	TORTA OLEAGINOSA con más del 1,5 % de aceite y un máximo del 11 % de humedad	 	
2025/11/09 10:58:33	CP	1385	CLASE 4 - SÓLIDOS INFLAMABLES	1385 - 4.2 - SULFURO SÓDICO ANHIDRO O SULFURO SÓDICO CON MENOS DEL 30% DE AGUA D	 	 	NO	 	NO	SI	4.2	 	II	SULFURO DE SODIO ANHIDRO o SULFURO DE SODIO con menos del 30 % de agua de cristalización	 	
2025/11/09 10:58:42	CP	1384	CLASE 4 - SÓLIDOS INFLAMABLES	1384 - 4.2 - DITIONITO SÓDICO (HIDROSULFITO SÓDICO)	 	 	NO	 	NO	SI	4.2	 	II	DITIONITO DE SODIO (HIDROSULFITO DE SODIO)	 	
2025/11/09 10:58:49	CP	1383	CLASE 4 - SÓLIDOS INFLAMABLES	1383 - 4.2 - METAL PIROFÓRICO; N.E.P.; O ALEACIÓN PIROFÓRICA; N.E.P.	 	 	NO	 	NO	SI	4.2	 	I	METAL PIROFÓRICO, N.E.P., o ALEACIÓN PIROFÓRICA, N.E.P.	 	
2025/11/09 10:58:58	CP	1382	CLASE 4 - SÓLIDOS INFLAMABLES	1382 - 4.2 - SULFURO POTÁSICO ANHIDRO O SULFURO POTÁSICO CON MENOS DEL 30% DE AG	 	 	NO	 	NO	SI	4.2	 	II	SULFURO DE POTASIO ANHIDRO o SULFURO DE POTASIO con menos del 30 % de agua de cristalización	 	
2025/11/09 10:59:10	CP	1381	CLASE 4 - SÓLIDOS INFLAMABLES	1381 - 4.2 - FÓSFORO BLANCO O AMARILLO; SECO O BAJO AGUA O EN SOLUCIÓN	 	 	NO	 	NO	SI	4.2	6.1	I	FÓSFORO BLANCO o AMARILLO, SECO o BAJO AGUA o EN SOLUCIÓN	 	
2025/11/09 10:59:18	CP	1380	CLASE 4 - SÓLIDOS INFLAMABLES	1380 - 4.2 - PENTABORANO	 	 	NO	 	NO	SI	4.2	6.1	I	PENTABORANO	 	
2025/11/09 10:59:37	CP	1379	CLASE 4 - SÓLIDOS INFLAMABLES	1379 - 4.2 - PAPEL TRATADO CON ACEITES NO SATURADOS; INCOMPLETAMENTE SECO (INCLU	 	 	NO	 	NO	SI	4.2	 	III	PAPEL TRATADO CON ACEITES NO SATURADOS, no completamente seco (incluido el papel carbón)	 	
2025/11/09 10:59:47	CP	1378	CLASE 4 - SÓLIDOS INFLAMABLES	1378 - 4.2 - CATALIZADOR DE METAL HUMEDECIDO CON UN EXCESO VISIBLE DE LÍQUIDO	 	 	NO	 	NO	SI	4.2	 	II	CATALIZADOR DE METAL HUMEDECIDO con un exceso visible de líquido	 	
2025/11/09 11:00:04	CP	1376	CLASE 4 - SÓLIDOS INFLAMABLES	1376 - 4.2 - ÓXIDO DE HIERRO AGOTADO O HIERRO ESPONJOSO AGOTADO PROCEDENTES DE L	 	 	NO	 	NO	SI	4.2	 	III	ÓXIDO DE HIERRO AGOTADO o HIERRO ESPONJOSO AGOTADO procedentes de la purificación del gas de hulla	 	
2025/11/09 11:00:15	CP	1374	CLASE 4 - SÓLIDOS INFLAMABLES	1374 - 4.2 - HARINA DE PESCADO (DESECHOS DE PESCADO) NO ESTABILIZADA	 	 	NO	 	NO	SI	4.2	 	II	HARINA DE PESCADO (DESECHOS DE PESCADO) NO ESTABILIZADA	 	
2025/11/09 11:00:23	CP	1373	CLASE 4 - SÓLIDOS INFLAMABLES	1373 - 4.2 - FIBRAS O TEJIDOS DE ORIGEN ANIMAL O VEGETAL O SINTÉTICOS; N.E.P.; I	 	 	NO	 	NO	SI	4.2	 	III	FIBRAS o TEJIDOS DE ORIGEN ANIMAL o VEGETAL o SINTÉTICOS, N.E.P., impregnados de aceite	 	
2025/11/09 11:00:31	CP	1372	CLASE 4 - SÓLIDOS INFLAMABLES	1372 - 4.2 - FIBRAS DE ORIGEN  ANIMAL O FIBRAS DE ORIGEN VEGETAL QUEMADAS; HÚMED	 	 	NO	 	NO	SI	4.2	 	III	FIBRAS DE ORIGEN ANIMAL o FIBRAS DE ORIGEN VEGETAL quemadas, húmedas o mojadas	 	
2025/11/09 11:01:01	CP	1369	CLASE 4 - SÓLIDOS INFLAMABLES	1369 - 4.2 - P-NITROSO-DIMETILANILINA	 	 	NO	 	NO	SI	4.2	 	II	p-NITROSODIMETILANILINA	 	
2025/11/09 11:01:40	CP	1365	CLASE 4 - SÓLIDOS INFLAMABLES	1365 - 4.2 - ALGODÓN HÚMEDO	 	 	NO	 	NO	SI	4.2	 	III	ALGODÓN HÚMEDO	 	
2025/11/09 11:01:50	CP	1364	CLASE 4 - SÓLIDOS INFLAMABLES	1364 - 4.2 - DESECHOS GRASIENTOS DE ALGODÓN	 	 	NO	 	NO	SI	4.2	 	III	DESECHOS GRASIENTOS DE ALGODÓN	 	
2025/11/09 11:01:58	CP	1363	CLASE 4 - SÓLIDOS INFLAMABLES	1363 - 4.2 - COPRA	 	 	NO	 	NO	SI	4.2	 	III	COPRA	 	
2025/11/09 11:02:04	CP	1362	CLASE 4 - SÓLIDOS INFLAMABLES	1362 - 4.2 - CARBÓN ACTIVADO	 	 	NO	 	NO	SI	4.2	 	III	CARBÓN ACTIVADO	 	
2025/11/09 11:02:14	CP	1361	CLASE 4 - SÓLIDOS INFLAMABLES	1361 - 4.2 - CARBÓN ANIMAL O VEGETAL	 	 	NO	 	NO	SI	4.2	 	II, III	CARBÓN de origen animal o vegetal	 	
2025/11/09 11:02:23	CP	1360	CLASE 4 - SÓLIDOS INFLAMABLES	1360 - 4.3 - FOSFURO CÁLCICO	 	 	NO	 	NO	SI	4.3	6.1	I	FOSFURO DE CALCIO	 	
2025/11/09 11:02:40	CP	1358	CLASE 4 - SÓLIDOS INFLAMABLES	1358 - 4.1 - CIRCONIO EN POLVO; HUMIDIFICADO CON UN MÍNIMO DEL 25% DE AGUA (DEBE	 	 	NO	 	NO	SI	4.1	 	II	CIRCONIO EN POLVO, HUMEDECIDO con un mínimo del 25 % de agua (debe haber un exceso visible de agua): a) producido mecánicamente, en partículas de menos de 53 micrones; b) producido químicamente, en partículas de menos de 840 micrones	 	
2025/11/09 11:02:51	CP	1357	CLASE 4 - SÓLIDOS INFLAMABLES	1357 - 4.1 - NITRATO DE UREA HUMIDIFICADO CON UN MÍNIMO DEL 20%; EN MASA; DE AGU	 	 	NO	 	NO	SI	4.1	 	I	NITRATO DE UREA HUMEDECIDO con un mínimo del 20 %, en masa, de agua	 	
2025/11/09 11:03:01	CP	1356	CLASE 4 - SÓLIDOS INFLAMABLES	1356 - 4.1 - TRINITROTOLUENO (TNT) HUMIDIFICADO CON UN MÍNIMO DEL 30%; EN MASA;	 	 	NO	 	NO	SI	4.1	 	I	TRINITROTOLUENO (TNT) HUMEDECIDO con un mínimo del 30 %, en masa, de agua	 	
2025/11/09 11:03:08	CP	1355	CLASE 4 - SÓLIDOS INFLAMABLES	1355 - 4.1 - ÁCIDO TRINITROBENZOICO HUMIDIFICADO CON UN MÍNIMO DEL 30%; EN MASA;	 	 	NO	 	NO	SI	4.1	 	I	ÁCIDO TRINITROBENZOICO HUMEDECIDO con un mínimo del 30 %, en masa, de agua	 	
2025/11/09 11:03:19	CP	1354	CLASE 4 - SÓLIDOS INFLAMABLES	1354 - 4.1 - TRINITROBENCENO HUMIDIFICADO CON UN MÍNIMO DEL 30%; EN MASA; DE AGU	 	 	NO	 	NO	SI	4.1	 	I	TRINITROBENCENO HUMEDECIDO con un mínimo del 30 %, en masa, de agua	 	
2025/11/09 11:03:28	CP	1353	CLASE 4 - SÓLIDOS INFLAMABLES	1353 - 4.1 - FIBRAS O TEJIDOS IMPREGNADOS DE NITROCELULOSA POCO NITRADA; N.E.P.	 	 	NO	 	NO	SI	4.1	 	III	FIBRAS o TEJIDOS IMPREGNADOS DE NITROCELULOSA POCO NITRADA, N.E.P.	 	
2025/11/09 11:03:36	CP	1352	CLASE 4 - SÓLIDOS INFLAMABLES	1352 - 4.1 - TITANIO EN POLVO; HUMIDIFICADO CON UN MÍNIMO DEL 25% DE AGUA (DEBE	 	 	NO	 	NO	SI	4.1	 	II	TITANIO EN POLVO, HUMEDECIDO con un mínimo del 25 % de agua (debe haber un exceso visible de agua): a) producido mecánicamente, en partículas de menos de 53 micrones; b) producido químicamente, en partículas de menos de 840 micrones	 	
2025/11/09 11:03:46	CP	1350	CLASE 4 - SÓLIDOS INFLAMABLES	1350 - 4.1 - AZUFRE	 	 	NO	 	NO	SI	4.1	 	III	AZUFRE	 	
2025/11/09 11:04:05	CP	1349	CLASE 4 - SÓLIDOS INFLAMABLES	1349 - 4.1 - PICRAMATO SÓDICO HUMIDIFICADO CON UN MÍNIMO DEL 20%; EN MASA; DE AG	 	 	NO	 	NO	SI	4.1	 	I	PICRAMATO DE SODIO HUMEDECIDO con un mínimo del 20 %, en masa, de agua	 	
2025/11/09 11:04:13	CP	1348	CLASE 4 - SÓLIDOS INFLAMABLES	1348 - 4.1 - DINITRO-O-CRESOLATO SÓDICO HUMIDIFICADO CON UN MÍNIMO DEL 15%; EN M	 	 	NO	 	NO	SI	4.1	6.1	I	DINITRO-o-CRESOLATO DE SODIO HUMEDECIDO con un mínimo del 15 %, en masa, de agua	 	
2025/11/09 11:04:22	CP	1347	CLASE 4 - SÓLIDOS INFLAMABLES	1347 - 4.1 - PICRATO DE PLATA HUMIDIFICADO CON UN MÍNIMO DEL 30%; EN MASA; DE AG	 	 	NO	 	NO	SI	4.1	 	I	PICRATO DE PLATA HUMEDECIDO con un mínimo del 30 %, en masa, de agua	 	
2025/11/09 11:04:29	CP	1346	CLASE 4 - SÓLIDOS INFLAMABLES	1346 - 4.1 - SILICIO EN POLVO; AMORFO	 	 	NO	 	NO	SI	4.1	 	III	SILICIO EN POLVO, AMORFO	 	
2025/11/09 11:04:37	CP	1345	CLASE 4 - SÓLIDOS INFLAMABLES	1345 - 4.1 - DESECHOS DE CAUCHO O RECORTES DE CAUCHO; EN POLVO O EN GRÁNULOS DE	 	 	NO	 	NO	SI	4.1	 	II	DESECHOS DE CAUCHO o RECORTES DE CAUCHO, en polvo o en gránulos de 840 micras como máximo y que contienen más del 45 % de caucho	 	
2025/11/09 11:04:44	CP	1344	CLASE 4 - SÓLIDOS INFLAMABLES	1344 - 4.1 - TRINITROFENOL (ÁCIDO PÍCRICO) HUMIDIFICADO  CON UN MÍNIMO DEL 30%;	 	 	NO	 	NO	SI	4.1	 	I	TRINITROFENOL (ÁCIDO PÍCRICO) HUMEDECIDO con un mínimo del 30 %, en masa, de agua	 	
2011/09/11 06:08:36	CP	1343	SÓLIDOS INFLAMABLES; SUSTANCIAS QUE PUEDEN EXPERIMENTAR COMBUSTIÓN ESPONTÁNEA; S	1343 - 4.1 - TRISULFURO DE FÓSFORO; que no contenga fósforo blanco o amarillo	SI	.	NO	 	NO	SI	4.1	 	II	TRISULFURO DE FÓSFORO, que no contiene fósforo blanco o amarillo	 	
2025/11/09 11:04:55	CP	1341	CLASE 4 - SÓLIDOS INFLAMABLES	1341 - 4.1 - SESQUISULFURO DE FÓSFORO; QUE NO CONTENGA FÓSFORO BLANCO O AMARILLO	 	 	NO	 	NO	SI	4.1	 	II	SESQUISULFURO DE FÓSFORO, que no contiene fósforo blanco o amarillo	 	
2025/11/09 11:05:02	CP	1340	CLASE 4 - SÓLIDOS INFLAMABLES	1340 - 4.3 - PENTASULFURO DE FÓSFORO; QUE NO CONTENGA FÓSFORO BLANCO O AMARILLO	 	 	NO	 	NO	SI	4.3	4.1	II	PENTASULFURO DE FÓSFORO, que no contiene fósforo blanco o amarillo	 	
2025/11/09 11:05:18	CP	1339	CLASE 4 - SÓLIDOS INFLAMABLES	1339 - 4.1 - HEPTASULFURO DE FÓSFORO; QUE NO CONTENGA FÓSFORO BLANCO O AMARILLO	 	 	NO	 	NO	SI	4.1	 	II	HEPTASULFURO DE FÓSFORO, que no contiene fósforo blanco o amarillo	 	
2025/11/09 11:05:26	CP	1338	CLASE 4 - SÓLIDOS INFLAMABLES	1338 - 4.1 - FÓSFORO AMORFO	 	 	NO	 	NO	SI	4.1	 	III	FÓSFORO AMORFO	 	
2025/11/09 11:05:34	CP	1337	CLASE 4 - SÓLIDOS INFLAMABLES	1337 - 4.1 - NITROALMIDÓN HUMIDIFICADO CON UN MÍNIMO DEL 20%; EN MASA; DE AGUA	 	 	NO	 	NO	SI	4.1	 	I	NITROALMIDÓN HUMEDECIDO con un mínimo del 20 %, en masa, de agua	 	
2025/11/09 11:05:42	CP	1336	CLASE 4 - SÓLIDOS INFLAMABLES	1336 - 4.1 - NITROGUANIDINA (PICRITA) HUMIDIFICADA CON UN MÍNIMO DEL 20%; EN MAS	 	 	NO	 	NO	SI	4.1	 	I	NITROGUANIDINA (PICRITA) HUMEDECIDA con un mínimo del 20 %, en masa, de agua	 	
2025/11/09 11:05:52	CP	1334	CLASE 4 - SÓLIDOS INFLAMABLES	1334 - 4.1 - NAFTALENO BRUTO O NAFTALENO REFINADO	 	 	NO	 	NO	SI	4.1	 	III	NAFTALENO BRUTO o NAFTALENO REFINADO	 	
2025/11/09 11:06:00	CP	1333	CLASE 4 - SÓLIDOS INFLAMABLES	1333 - 4.1 - CERIO; EN PLACAS; LINGOTES O BARRAS	 	 	NO	 	NO	SI	4.1	 	II	CERIO, en placas, lingotes o barras	 	
2025/11/09 11:06:14	CP	1332	CLASE 4 - SÓLIDOS INFLAMABLES	1332 - 4.1 - METALDEHIDO	 	 	NO	 	NO	SI	4.1	 	III	METALDEHÍDO	 	
2025/11/09 11:06:21	CP	1331	CLASE 4 - SÓLIDOS INFLAMABLES	1331 - 4.1 - FÓSFOROS DISTINTOS DE LOS DE SEGURIDAD	 	 	NO	 	NO	SI	4.1	 	III	FÓSFOROS DISTINTOS DE LOS DE SEGURIDAD	 	
2025/11/09 11:06:28	CP	1330	CLASE 4 - SÓLIDOS INFLAMABLES	1330 - 4.1 - RESINATO DE MANGANESO	 	 	NO	 	NO	SI	4.1	 	III	RESINATO DE MANGANESO	 	
2025/11/09 11:06:46	CP	1328	CLASE 4 - SÓLIDOS INFLAMABLES	1328 - 4.1 - HEXAMETILENOTETRAMINA	 	 	NO	 	NO	SI	4.1	 	III	HEXAMETILENTETRAMINA	 	
2025/11/09 11:07:30	CP	1327	CLASE 4 - SÓLIDOS INFLAMABLES	1327 - 4.1 - HENO; PAJA O BUSHA (TAMO)	 	 	NO	 	NO	SI	4.1	 	 	HENO, PAJA o BHUSA (TAMO)	 	
2025/11/09 11:07:38	CP	1326	CLASE 4 - SÓLIDOS INFLAMABLES	1326 - 4.1 - HAFNIO EN POLVO; HUMIDIFICADO CON UN MÍNIMO DEL 25% DE AGUA (DEBE H	 	 	NO	 	NO	SI	4.1	 	II	HAFNIO EN POLVO, HUMEDECIDO con un mínimo del 25 % de agua (debe haber un exceso visible de agua): a) producido mecánicamente, en partículas de menos de 53 micrones; b) producido químicamente, en partículas de menos de 840 micrones	 	
2025/11/09 11:07:46	CP	1325	CLASE 4 - SÓLIDOS INFLAMABLES	1325 - 4.1 - SÓLIDO INFLAMABLE ORGÁNICO; N.E.P.	 	 	NO	 	NO	SI	4.1	 	II, III	SÓLIDO INFLAMABLE ORGÁNICO, N.E.P.	 	
2025/11/09 11:07:53	CP	1324	CLASE 4 - SÓLIDOS INFLAMABLES	1324 - 4.1 - PELÍCULAS DE SOPORTE NITROCELULÓSICO REVESTIDO DE GELATINA; CON EXC	 	 	NO	 	NO	SI	4.1	 	III	PELÍCULAS DE SOPORTE NITROCELULÓSICO revestido de gelatina, con exclusión de los desechos	 	
2025/11/09 11:08:01	CP	1323	CLASE 4 - SÓLIDOS INFLAMABLES	1323 - 4.1 - FERROCERIO	 	 	NO	 	NO	SI	4.1	 	II	FERROCERIO	 	
2025/11/09 11:08:09	CP	1322	CLASE 4 - SÓLIDOS INFLAMABLES	1322 - 4.1 - DINITRORRESORCINOL (DINITRORRESORCINA) HUMIDIFICADO CON UN MÍNIMO D	 	 	NO	 	NO	SI	4.1	 	I	DINITRORRESORCINOL (DINITRORRESORCINA) HUMEDECIDO con un mínimo del 15 %, en masa, de agua	 	
2025/11/09 11:08:17	CP	1321	CLASE 4 - SÓLIDOS INFLAMABLES	1321 - 4.1 - DINITROFENOLATOS HUMIDIFICADOS CON UN MÍNIMO DEL 15%; EN MASA; DE A	 	 	NO	 	NO	SI	4.1	6.1	I	DINITROFENOLATOS HUMEDECIDOS con un mínimo del 15 %, en masa, de agua	 	
2025/11/09 11:08:24	CP	1320	CLASE 4 - SÓLIDOS INFLAMABLES	1320 - 4.1 - DINITROFENOL HUMIDIFICADO CON UN MÍNIMO DEL 15%; EN MASA; DE AGUA	 	 	NO	 	NO	SI	4.1	6.1	I	DINITROFENOL HUMEDECIDO con un mínimo del 15 %, en masa, de agua	 	
2025/11/09 11:08:47	CP	1318	CLASE 4 - SÓLIDOS INFLAMABLES	1318 - 4.1 - RESINATO DE COBALTO; PRECIPITADO	 	 	NO	 	NO	SI	4.1	 	III	RESINATO DE COBALTO, PRECIPITADO	 	
2025/11/09 11:09:05	CP	1314	CLASE 4 - SÓLIDOS INFLAMABLES	1314 - 4.1 - RESINATO CÁLCICO FUNDIDO	 	 	NO	 	NO	SI	4.1	 	III	RESINATO DE CALCIO FUNDIDO	 	
2025/11/09 11:09:12	CP	1313	CLASE 4 - SÓLIDOS INFLAMABLES	1313 - 4.1 - RESINATO CÁLCICO	 	 	NO	 	NO	SI	4.1	 	III	RESINATO DE CALCIO	 	
2025/11/09 11:09:18	CP	1312	CLASE 4 - SÓLIDOS INFLAMABLES	1312 - 4.1 - BORNEOL	 	 	NO	 	NO	SI	4.1	 	III	BORNEOL	 	
2025/11/09 11:09:28	CP	1310	CLASE 4 - SÓLIDOS INFLAMABLES	1310 - 4.1 - PICRATO AMÓNICO HUMIDIFICADO CON UN MÍNIMO DEL 10%; EN MASA; DE AGU	 	 	NO	 	NO	SI	4.1	 	I	PICRATO DE AMONIO HUMEDECIDO con un mínimo del 10 %, en masa, de agua	 	
2025/11/09 11:09:41	CP	1309	CLASE 4 - SÓLIDOS INFLAMABLES	1309 - 4.1 - ALUMINIO EN POLVO; RECUBIERTO	 	 	NO	 	NO	SI	4.1	 	II, III	ALUMINIO EN POLVO, RECUBIERTO	 	
2025/11/09 11:09:48	CP	1308	CLASE 3 - LÍQUIDOS INFLAMABLES	1308 - 3 - CIRCONIO EN SUSPENSIÓN EN UN LÍQUIDO INFLAMABLE	 	 	NO	 	NO	SI	3	 	I, II, III	CIRCONIO EN SUSPENSIÓN EN UN LÍQUIDO INFLAMABLE	 	
2025/11/09 11:09:55	CP	1307	CLASE 3 - LÍQUIDOS INFLAMABLES	1307 - 3 - XILENOS	 	 	NO	 	NO	SI	3	 	II, III	XILENOS	 	
2025/11/09 11:10:03	CP	1306	CLASE 3 - LÍQUIDOS INFLAMABLES	1306 - 3 - PRODUCTOS LÍQUIDOS PARA LA CONSERVACIÓN DE LA MADERA	 	 	NO	 	NO	SI	3	 	II, III	PRODUCTOS LÍQUIDOS PARA LA CONSERVACIÓN DE LA MADERA	 	
2025/11/09 11:10:09	CP	1305	CLASE 3 - LÍQUIDOS INFLAMABLES	1305 - 3 - VINILTRICLOROSILANO	 	 	NO	 	NO	SI	3	8	II	VINILTRICLOROSILANO	 	
2025/11/09 11:10:19	CP	1304	CLASE 3 - LÍQUIDOS INFLAMABLES	1304 - 3 - VINIL ISOBUTIL ÉTER ESTABILIZADO	 	 	NO	 	NO	SI	3	 	II	VINIL ISOBUTIL ÉTER ESTABILIZADO	 	
2025/11/09 11:10:27	CP	1303	CLASE 3 - LÍQUIDOS INFLAMABLES	1303 - 3 - CLORURO DE VINILIDENO ESTABILIZADO	 	 	NO	 	NO	SI	3	 	I	CLORURO DE VINILIDENO ESTABILIZADO	 	
2025/11/09 11:10:34	CP	1302	CLASE 3 - LÍQUIDOS INFLAMABLES	1302 - 3 - VINIL ETIL ÉTER ESTABILIZADO	 	 	NO	 	NO	SI	3	 	I	VINIL ETIL ÉTER ESTABILIZADO	 	
2025/11/09 11:10:41	CP	1301	CLASE 3 - LÍQUIDOS INFLAMABLES	1301 - 3 - ACETATO DE VINILO ESTABILIZADO	 	 	NO	 	NO	SI	3	 	II	ACETATO DE VINILO ESTABILIZADO	 	
2025/11/09 11:10:48	CP	1300	CLASE 3 - LÍQUIDOS INFLAMABLES	1300 - 3 - SUCEDÁNEO DE TREMENTINA	 	 	NO	 	NO	SI	3	 	II, III	SUCEDÁNEO DE TREMENTINA	 	
2025/11/09 13:04:47	CP	1299	CLASE 3 - LÍQUIDOS INFLAMABLES	1299 - 3 - TREMENTINA	 	 	NO	 	NO	SI	3	 	III	TREMENTINA	 	
2025/11/09 13:04:55	CP	1298	CLASE 3 - LÍQUIDOS INFLAMABLES	1298 - 3 - TRIMETILCLOROSILANO	 	 	NO	 	NO	SI	3	8	II	TRIMETILCLOROSILANO	 	
2025/11/09 13:05:04	CP	1297	CLASE 3 - LÍQUIDOS INFLAMABLES	1297 - 3 - TRIMETILAMINA EN SOLUCIÓN ACUOSA; CON UN MÁXIMO DEL 50 POR CIENTO; EN MASA; DE	 	 	NO	 	NO	SI	3	8	I, II, III	TRIMETILAMINA EN SOLUCIÓN ACUOSA, con un máximo del 50 por ciento, en masa, de trimetilamina	 	
2025/11/09 13:05:14	CP	1296	CLASE 3 - LÍQUIDOS INFLAMABLES	1296 - 3 - TRIETILAMINA	 	 	NO	 	NO	SI	3	8	II	TRIETILAMINA	 	
2025/11/09 13:05:22	CP	1295	CLASE 4 - SÓLIDOS INFLAMABLES	1295 - 4.3 - TRICLOROSILANO	 	 	NO	 	NO	SI	4.3	3, 8	I	TRICLOROSILANO	 	
2025/11/09 13:05:30	CP	1294	CLASE 3 - LÍQUIDOS INFLAMABLES	1294 - 3 - TOLUENO	 	 	NO	 	NO	SI	3	 	II	TOLUENO	 	
2025/11/09 13:05:38	CP	1293	CLASE 3 - LÍQUIDOS INFLAMABLES	1293 - 3 - TINTURAS MEDICINALES	 	 	NO	 	NO	SI	3	 	III	TINTURAS MEDICINALES	 	
2025/11/09 13:05:48	CP	1292	CLASE 3 - LÍQUIDOS INFLAMABLES	1292 - 3 - SILICATO DE TETRAETILO	 	 	NO	 	NO	SI	3	 	III	SILICATO DE TETRAETILO	 	
2025/11/09 13:06:03	CP	1289	CLASE 3 - LÍQUIDOS INFLAMABLES	1289 - 3 - METILATO SÓDICO EN SOLUCIÓN ALCOHÓLICA	 	 	NO	 	NO	SI	3	8	II, III	METILATO DE SODIO EN SOLUCIÓN alcohólica	 	
2025/11/09 13:06:14	CP	1288	CLASE 3 - LÍQUIDOS INFLAMABLES	1288 - 3 - ACEITE DE ESQUISTO	 	 	NO	 	NO	SI	3	 	II, III	ACEITE DE ESQUISTO	 	
2025/11/09 13:06:21	CP	1287	CLASE 3 - LÍQUIDOS INFLAMABLES	1287 - 3 - DISOLUCIÓN DE CAUCHO	 	 	NO	 	NO	SI	3	 	II, III	DISOLUCIÓN DE CAUCHO	 	
2025/11/09 13:06:28	CP	1286	CLASE 3 - LÍQUIDOS INFLAMABLES	1286 - 3 - ACEITE DE COLOFONIA	 	 	NO	 	NO	SI	3	 	II, III	ACEITE DE COLOFONIA	 	
2025/11/09 13:06:50	CP	1282	CLASE 3 - LÍQUIDOS INFLAMABLES	1282 - 3 - PIRIDINA	 	 	NO	 	NO	SI	3	 	II	PIRIDINA	 	
2025/11/09 13:06:57	CP	1281	CLASE 3 - LÍQUIDOS INFLAMABLES	1281 - 3 - FORMIATOS DE PROPILO	 	 	NO	 	NO	SI	3	 	II	FORMIATOS DE PROPILO	 	
2025/11/09 13:07:05	CP	1280	CLASE 3 - LÍQUIDOS INFLAMABLES	1280 - 3 - ÓXIDO DE PROPILENO	 	 	NO	 	NO	SI	3	 	I	ÓXIDO DE PROPILENO	 	
2025/11/09 13:07:20	CP	1279	CLASE 3 - LÍQUIDOS INFLAMABLES	1279 - 3 - 1;2-DICLOROPROPANO	 	 	NO	 	NO	SI	3	 	II	1,2-DICLOROPROPANO	 	
2025/11/09 13:07:28	CP	1278	CLASE 3 - LÍQUIDOS INFLAMABLES	1278 - 3 - 1-CLOROPROPANO	 	 	NO	 	NO	SI	3	 	II	1-CLOROPROPANO	 	
2025/11/09 13:07:37	CP	1277	CLASE 3 - LÍQUIDOS INFLAMABLES	1277 - 3 - PROPILAMINA	 	 	NO	 	NO	SI	3	8	II	PROPILAMINA	 	
2025/11/09 13:07:44	CP	1276	CLASE 3 - LÍQUIDOS INFLAMABLES	1276 - 3 - ACETATO DE N-PROPILO	 	 	NO	 	NO	SI	3	 	II	ACETATO DE n-PROPILO	 	
2025/11/09 13:07:51	CP	1275	CLASE 3 - LÍQUIDOS INFLAMABLES	1275 - 3 - PROPIONALDEHIDO	 	 	NO	 	NO	SI	3	 	II	PROPIONALDEHÍDO	 	
2025/11/09 13:08:00	CP	1274	CLASE 3 - LÍQUIDOS INFLAMABLES	1274 - 3 - N-PROPANOL (ALCOHOL PROPÍLICO NORMAL)	 	 	NO	 	NO	SI	3	 	III	n-PROPANOL (ALCOHOL PROPÍLICO NORMAL)	 	
2025/11/09 13:08:12	CP	1272	CLASE 3 - LÍQUIDOS INFLAMABLES	1272 - 3 - ACEITE DE PINO	 	 	NO	 	NO	SI	3	 	III	ACEITE DE PINO	 	
2025/11/09 13:08:30	CP	1268	CLASE 3 - LÍQUIDOS INFLAMABLES	1268 - 3 - DESTILADOS DE PETRÓLEO; N.E.P. O PRODUCTOS DE PETRÓLEO; N.E.P.	 	 	SI	 	NO	SI	3	 	I, II, III	DESTILADOS DE PETRÓLEO, N.E.P. o PRODUCTOS DE PETRÓLEO, N.E.P.	 	
2025/11/09 13:08:37	CP	1267	CLASE 3 - LÍQUIDOS INFLAMABLES	1267 - 3 - PETRÓLEO BRUTO	 	 	SI	 	NO	SI	3	 	I, II, III	PETRÓLEO BRUTO	 	
2025/11/09 13:08:48	CP	1266	CLASE 3 - LÍQUIDOS INFLAMABLES	1266 - 3 - PRODUCTOS DE PERFUMERÍA QUE CONTENGAN DISOLVENTES INFLAMABLES	 	 	NO	 	NO	SI	3	 	II, III	PRODUCTOS DE PERFUMERÍA que contengan disolventes inflamables	 	
2025/11/09 13:08:55	CP	1265	CLASE 3 - LÍQUIDOS INFLAMABLES	1265 - 3 - PENTANOS LÍQUIDOS	 	 	NO	 	NO	SI	3	 	I, II	PENTANOS líquidos	 	
2025/11/09 13:09:09	CP	1264	CLASE 3 - LÍQUIDOS INFLAMABLES	1264 - 3 - PARALDEHIDO	 	 	NO	 	NO	SI	3	 	III	PARALDEHÍDO	 	
2025/11/09 13:09:18	CP	1263	CLASE 3 - LÍQUIDOS INFLAMABLES	1263 - 3 - PINTURA (INCLUYE PINTURA; LACA; ESMALTE; COLORANTE; GOMA LACA; BARNIZ	 	 	NO	 	NO	SI	3	 	I, II, III	PINTURAS (incluidos pinturas, lacas, esmaltes, colorantes, goma laca, barnices, bruñidores, encáusticos, apresto líquido y bases líquidas para lacas) o PRODUCTOS PARA PINTURA (incluidos disolventes y diluyentes para pinturas)	 	
2025/11/09 13:09:26	CP	1262	CLASE 3 - LÍQUIDOS INFLAMABLES	1262 - 3 - OCTANOS	 	 	NO	 	NO	SI	3	 	II	OCTANOS	 	
2025/11/09 13:09:34	CP	1261	CLASE 3 - LÍQUIDOS INFLAMABLES	1261 - 3 - NITROMETANO	 	 	NO	 	NO	SI	3	 	II	NITROMETANO	 	
2025/11/09 13:10:34	CP	1259	CLASE 6 - SUSTANCIAS TÓXICAS Y SUSTANCIAS INFECCIOSAS	1259 - 6.1 - NÍQUEL CARBONILO	 	 	NO	 	NO	SI	6.1	3	I	NÍQUEL CARBONILO	 	
2025/11/09 13:10:42	CP	1251	CLASE 6 - SUSTANCIAS TÓXICAS Y SUSTANCIAS INFECCIOSAS	1251 - 6.1 - METILVINILCETONA; ESTABILIZADA	 	 	NO	 	NO	SI	6.1	3, 8	I	METILVINILCETONA, ESTABILIZADA	 	
2025/11/09 13:10:50	CP	1250	CLASE 3 - LÍQUIDOS INFLAMABLES	1250 - 3 - METILTRICLOROSILANO	 	 	NO	 	NO	SI	3	8	II	METILTRICLOROSILANO	 	
2025/11/09 13:11:12	CP	1249	CLASE 3 - LÍQUIDOS INFLAMABLES	1249 - 3 - METILPROPILCETONA	 	 	NO	 	NO	SI	3	 	II	METILPROPILCETONA	 	
2025/11/09 13:11:23	CP	1248	CLASE 3 - LÍQUIDOS INFLAMABLES	1248 - 3 - PROPIONATO DE METILO	 	 	NO	 	NO	SI	3	 	II	PROPIONATO DE METILO	 	
2025/11/09 13:11:31	CP	1247	CLASE 3 - LÍQUIDOS INFLAMABLES	1247 - 3 - METACRILATO DE METILO MONÓMERO ESTABILIZADO	 	 	NO	 	NO	SI	3	 	II	METACRILATO DE METILO MONÓMERO ESTABILIZADO	 	
